product_id,name,description,price,category
1,Wireless Bluetooth Headphones,High-quality wireless headphones with noise cancellation and long battery life,99.99,Electronics
2,Organic Cotton T-Shirt,Comfortable organic cotton t-shirt available in multiple colors,24.99,Clothing
3,Stainless Steel Water Bottle,Durable stainless steel water bottle that keeps drinks cold for 24 hours,19.99,Home & Garden
4,Smartphone Case,Protective smartphone case with shock absorption and wireless charging compatibility,14.99,Electronics
5,Yoga Mat,Non-slip yoga mat made from eco-friendly materials perfect for all types of workouts,34.99,Sports & Fitness
